{
  "id": "99999999-9999-4999-8999-999999999999",
  "schemaVersion": "0.1.0",
  "name": "Bad EG – Beispielprojekt",
  "zustand": "planVorschlag",
  "raumRefs": ["11111111-1111-4111-8111-111111111111"],
  "stilprofilRef": "33333333-3333-4333-8333-333333333333",
  "planRefs": ["22222222-2222-4222-8222-222222222222"],
  "dokumente": [],
  "createdAt": "2026-06-11T11:00:00Z",
  "retentionUntil": "2027-06-11T11:00:00Z",
  "contributors": ["bryan"]
}
